{
  "schema": "arbiter-agent-return-v1",
  "agent": "2624-combined-code-review",
  "role": "reviewer",
  "taskId": "#2624",
  "branch": "task/#2624-release-pipeline",
  "sha": "20013aa2cf9196782c3dba7b87d0e2ffde4603f6",
  "ts": "2026-09-09T21:45:44.658Z",
  "verdict": "PASS",
  "confidence": 0.96,
  "findings": [],
  "provenance": {
    "vendor": "openai",
    "dispatch": "subagent",
    "cli": "codex"
  }
}
