{
  "schema": "arbiter-agent-return-v1",
  "agent": "2693-final-testing",
  "role": "reviewer",
  "taskId": "#2693",
  "branch": "task/#2693-exact-tree-gate-reuse",
  "sha": "f607de470829ce0c4bda76e34d7fcedd69206817",
  "verdict": "PASS",
  "confidence": 0.97,
  "findings": [],
  "refutations": [],
  "ts": "2026-09-15T07:39:57.316Z",
  "provenance": {
    "vendor": "openai",
    "dispatch": "external-cli",
    "cli": "codex",
    "cliVersion": "0.154.0"
  }
}
