{
  "schema": "arbiter-agent-return-v1",
  "agent": "native-ship-host-final-confirmation",
  "role": "reviewer",
  "taskId": "#2685",
  "branch": "task/#2685-native-ship-host",
  "sha": "2dc17f1202ad9feb8928f4a17b5519f6af9c4197",
  "ts": "2026-09-15T04:15:27.953Z",
  "verdict": "PASS",
  "confidence": 0.99,
  "findings": [],
  "provenance": {
    "vendor": "anthropic",
    "dispatch": "subagent"
  }
}
