{
  "schema": "arbiter-agent-return-v1",
  "agent": "2693-final-lifecycle",
  "role": "reviewer",
  "taskId": "#2693",
  "verdict": "PASS",
  "confidence": 0.87,
  "findings": [],
  "refutations": [],
  "branch": "task/#2693-exact-tree-gate-reuse",
  "sha": "7ad7f84d9d6efc079f92c70f7eb556e376201a74",
  "ts": "2026-09-15T08:20:24.633Z",
  "provenance": {
    "vendor": "openai",
    "dispatch": "external-cli",
    "cli": "codex",
    "cliVersion": "0.154.0"
  }
}
