{
  "schema": "arbiter-agent-return-v1",
  "agent": "2693-gatefix-testing",
  "role": "reviewer",
  "taskId": "#2693",
  "branch": "task/#2693-exact-tree-gate-reuse",
  "sha": "1341a52442f15dd277f07a993ba6740c5cd0ed84",
  "verdict": "PASS",
  "confidence": 0.83,
  "findings": [],
  "refutations": [],
  "ts": "2026-09-15T07:55:15.524Z",
  "provenance": {
    "vendor": "openai",
    "dispatch": "external-cli",
    "cli": "codex",
    "cliVersion": "0.154.0"
  }
}
