{
  "schema": "arbiter-agent-return-v1",
  "agent": "agent2578-final-acfit",
  "role": "skeptic",
  "taskId": "#2624",
  "branch": "task/#2624-release-pipeline",
  "sha": "029dbfc0fb6f2e300a5a1ec3d09a378a1b3117e4",
  "ts": "2026-09-09T20:44:51.973Z",
  "verdict": "PASS",
  "confidence": 0.93,
  "findings": [],
  "provenance": {
    "vendor": "openai",
    "dispatch": "subagent",
    "cli": "codex"
  }
}
