{
  "schema": "arbiter-agent-return-v1",
  "agent": "2624-code-review",
  "role": "reviewer",
  "taskId": "#2624",
  "branch": "task/#2624-release-pipeline",
  "sha": "663152c2e7b7dcc65188538887567cc8609b438c",
  "ts": "2026-09-09T21:15:41.519Z",
  "verdict": "PASS",
  "confidence": 0.98,
  "findings": [],
  "provenance": {
    "vendor": "openai",
    "dispatch": "subagent",
    "cli": "codex"
  }
}
