{
  "schema": "arbiter-agent-return-v1",
  "agent": "silent-failures-review",
  "role": "reviewer",
  "taskId": "#2597",
  "branch": "task/#2597-pack-size-preflight",
  "sha": "929d1eb78c49302e9d0665ffd946ee8bf4fc616b",
  "ts": "2026-09-08T08:49:25.756Z",
  "verdict": "PASS",
  "confidence": 0.96,
  "findings": [],
  "evidenceRefs": [
    ".claude/plans/2597-strict-pack-size.md",
    "scripts/build-dist.mjs:17-95",
    "package.json:61-67",
    "__tests__/integration/e2e/functional/packaged-artifact.test.ts:53-102",
    "__tests__/integration/e2e/functional/packaged-artifact.test.ts:472-590",
    "/home/luca/work/forma-rooms/portfolio/evidence/arbiter-2597/cycle-1788856490/artifact/npm-pack.json",
    "/home/luca/work/forma-rooms/portfolio/evidence/arbiter-2597/cycle-1788856490/consumer-receipt.json"
  ],
  "provenance": {
    "vendor": "openai",
    "dispatch": "subagent",
    "cli": "codex"
  }
}
