{
  "schema": "arbiter-agent-return-v1",
  "agent": "docs2486-verifier",
  "role": "verifier",
  "taskId": "#2486",
  "branch": "task/#2486-pr-base-concurrency",
  "sha": "440d87c093b99049b4bb3771b2b2a97c772c2f49",
  "ts": "2026-09-09T03:15:35.240Z",
  "verdict": "PASS",
  "confidence": 0.99,
  "findings": [],
  "provenance": {
    "vendor": "openai",
    "dispatch": "subagent"
  }
}
