{
  "schema": "arbiter-agent-return-v1",
  "agent": "codex-reviewer",
  "role": "reviewer",
  "taskId": "#2681",
  "verdict": "WARN",
  "confidence": 0.7,
  "findings": [
    {
      "id": "review-limitation",
      "severity": "info",
      "kind": "process",
      "claim": "No confirmed bugs found in the supplied diff. Repository inspection and tests were blocked by a tool startup failure. The fail-closed guarantee remains unverified: the new exemption is safe only if loadConfig does not default missing or malformed collaborationMode values to trunk-solo. Add regression coverage for both cases.",
      "citations": [
        {
          "file": "src/commands/task.ts",
          "line": 1287
        },
        {
          "file": "__tests__/commands/task-advance-gates.test.ts",
          "line": 252
        }
      ]
    }
  ],
  "refutations": [],
  "branch": "task/#2681-ship-review-economy",
  "sha": "c7aabe4584a739688c45570154c5ba4893efa7b6",
  "ts": "2026-09-15T11:01:26.273Z",
  "provenance": {
    "vendor": "openai",
    "dispatch": "external-cli",
    "cli": "codex",
    "cliVersion": "0.154.0"
  }
}
